Negative,Polarity,Positive,Subjectivity,author,content,description,publishedAt,source,title,url,urlToImage
3,0.24999996875000394,5,0.16326530279050402,Reuters,"By Stephen Culp NEW YORK (Reuters) - The S&amp;P 500 and the Dow Jones industrial average rose on Wednesday, with the Dow hitting its highest level since late January as rising Treasury yields boosted the financial sector and trade jitters abated. Technology … [+3043 chars]","By Stephen Culp NEW YORK (Reuters) - The S&P 500 and the Dow Jones industrial average rose on Wednesday, with the Dow hitting its highest level since late January as rising Treasury yields boosted the financial sector and trade jitters abated. Technology stoc…",2018-09-19T21:35:19Z,"{'id': None, 'name': 'Firstpost.com'}","Financials boost S&P 500, Dow; tech drags on Nasdaq",https://www.firstpost.com/business/financials-boost-s-tech-drags-on-nasdaq-5219821.html,"https://res.cloudinary.com/firstpost/image/upload/q_auto,f_auto,fl_lossy/nw18-firstpost/reuters/09-2018/20/2018-09-19T142733Z_1_LYNXNPEE8I1IB_RTROPTP_2_USA-STOCKS.jpg"
4,0.11111109876543349,5,0.19148935762788602,Reuters,"By Stephen Culp NEW YORK (Reuters) - The S&amp;P 500 and the Dow Jones industrial average rose on Wednesday, with the Dow hitting its highest closing level since late January as rising Treasury yields boosted the financial sector and trade worries subsided. T… [+2995 chars]","By Stephen Culp NEW YORK (Reuters) - The S&P 500 and the Dow Jones industrial average rose on Wednesday, with the Dow hitting its highest closing level since late January as rising Treasury yields boosted the financial sector and trade worries subsided. The t…",2018-09-19T21:35:24Z,"{'id': None, 'name': 'Firstpost.com'}","S&P 500, Dow up as rising treasury yields boost banks",https://www.firstpost.com/business/sp-500-dow-up-as-rising-treasury-yields-boost-banks-5219831.html,"https://res.cloudinary.com/firstpost/image/upload/q_auto,f_auto,fl_lossy/nw18-firstpost/reuters/09-2018/20/2018-09-19T142733Z_1_LYNXNPEE8I1IB_RTROPTP_2_USA-STOCKS.jpg"
2,-0.99999950000025,0,0.03636363570247935,Bruno Federowski,"BRASILIA/SAO PAULO (Reuters) - Far-right Brazilian presidential candidate Jair Bolsonaro vowed on Tuesday to appoint non-partisan ministers, breaking with the tradition of building cabinets through coalitions, as part of his bid to tackle graft in Latin Ameri… [+4497 chars]","Far-right Brazilian presidential candidate Jair Bolsonaro vowed on Tuesday to appoint non-partisan ministers, breaking with the tradition of building cabinets through coalitions, as part of his bid to tackle graft in Latin America's largest economy.",2018-10-09T18:32:27Z,"{'id': 'reuters', 'name': 'Reuters'}",Brazil's far-right Bolsonaro: No coalition politics in cabinet picks,https://www.reuters.com/article/us-brazil-election/brazils-far-right-bolsonaro-no-coalition-politics-in-cabinet-picks-idUSKCN1MJ27U,https://s2.reutersmedia.net/resources/r/?m=02&d=20181009&t=2&i=1312937297&w=1200&r=LYNXNPEE981G3
0,0.9999990000010001,1,0.045454543388429844,Caroline Hudson,,"Charlotte-based Bank of America Corp. (NYSE: BAC) hit another home run in its third-quarter earnings, which it reported to the public Monday morning. BofA posted $7.2 billion in net income, or 66 cents in diluted earnings per share, in the third quarter, a 32…",2018-10-15T20:20:14Z,"{'id': None, 'name': 'Bizjournals.com'}",CEO talks about how Bank of America drove up profits for its best quarter yet,https://www.bizjournals.com/triangle/news/2018/10/15/how-bank-of-america-drove-up-profits-for-its-best.html?ana=RSS&s=article_search&utm_source=feedburner&utm_medium=feed&utm_campaign=Feed%3A+bizj_triangle+%28Triangle+Business+Journal%29,
2,-0.99999950000025,0,0.03846153772189351,Saeed Azhar,DUBAI/LONDON (Reuters) - The U.S. treasury secretary and top Wall Street banks will attend a Saudi investment conference even as top media companies and business leaders pull out after the disappearance of a Saudi journalist. Steve Mnuchin’s plans to attend t… [+4997 chars],The U.S. treasury secretary and top Wall Street banks will attend a Saudi investment conference even as top media companies and business leaders pull out after the disappearance of a Saudi journalist.,2018-10-12T13:53:49Z,"{'id': 'reuters', 'name': 'Reuters'}","U.S. treasurer, banks to attend Saudi conference amid media exit over missing journalist",https://www.reuters.com/article/us-saudi-politics-dissident-conference/u-s-treasurer-banks-to-attend-saudi-conference-amid-media-exit-over-missing-journalist-idUSKCN1MM1GJ,https://s2.reutersmedia.net/resources/r/?m=02&d=20181012&t=2&i=1314009708&w=1200&r=LYNXNPEE9B0XH
2,0.0,2,0.11111110802469146,Frank Holmes,"In case you couldnt tell from the ubiquitous political ads and yard signs, midterm elections are right around the corner. Historically, volatility has increased and markets have dipped leading up to midterms on uncertainty, but afterward theyve outperformed. … [+7982 chars]",Government policy is a precursor to change. Money managers and banks are adding safe havens at a faster pace. The next crisis could be triggered by passive inde,2018-09-25T06:54:45Z,"{'id': None, 'name': 'Seekingalpha.com'}",The Best Time To Prepare Is While The Bull Runs,https://seekingalpha.com/article/4208054-best-time-prepare-bull-runs,https://static2.seekingalpha.com/uploads/2018/9/24/saupload_COMM-bull-run-09212018.jpg
0,0.0,0,0.0,NASCAR.com,"The anticipation is skyrocketing ahead of Monster Energy NASCAR Cup Series and Xfinity Series action at the brand new Charlotte Motor Speedway road course. Theres a lot to learn about the 17-turn, 2.28-mile course ahead of Saturdays Xfinity Series Drive for t… [+5001 chars]","The anticipation is skyrocketing ahead of Monster Energy NASCAR Cup Series and Xfinity Series action at the brand new Charlotte Motor Speedway road course. There’s a lot to learn about the 17-turn, 2.28-mile course ahead of Saturday’s Xfinity Series Drive for…",2018-09-27T14:09:44Z,"{'id': None, 'name': 'Yahoo.com'}",Turn-by-turn analysis of the new Charlotte road course,https://sports.yahoo.com/turn-turn-analysis-charlotte-road-140944859.html,https://s.yimg.com/uu/api/res/1.2/A_fWOHkCYni7h27NQ.M67w--~B/aD0xNzA7dz0zMjA7c209MTthcHBpZD15dGFjaHlvbg--/http://media.zenfs.com/en-US/homerun/nascar.com/9b9daf6ebff8fdeb0ef3a9c89aff7395
0,0.0,0,0.0,,"Companies such as Amazon, Microsoft and Oracle will reap a financial windfall by offering blockchain as a service, a market that's quickly growing as companies look for ways to use the distributed ledger technology without spending a lot of money. If just 2% … [+197 chars]","Companies such as Amazon, Microsoft and Oracle will reap a financial windfall by offering blockchain as a service , a market that&#39;s quickly growing as companies look for ways to use the distributed ledger technology without spending a lot of money. If jus…",2018-10-04T05:48:43Z,"{'id': None, 'name': 'Topix.com'}",Blockchain-as-a-service predicted to be $7B market,http://www.topix.com/business/telecom/2018/10/blockchain-as-a-service-predicted-to-be-7b-market?fromrss=1,http://picproxy.topixcdn.com/pics/up-
0,0.0,0,0.0,AP,"All Times Eastern NASCAR BANK OF AMERICA ROVAL 400 Site: Charlotte Schedule: Friday, practice, 12:05 p.m. (NBCSN), qualifying, 4:45 p.m. (NBCSN); Saturday, practice, 11 a.m. &amp; 1:30 p.m. (NBCSN); Sunday, race, 2 p.m., NBC. Track: Charlotte Motor Speedway R… [+3127 chars]",AUTO RACING: Auto Racing Glance,2018-09-26T15:59:08Z,"{'id': 'fox-sports', 'name': 'Fox Sports'}",AUTO RACING: Auto Racing Glance,https://www.foxsports.com/motor/story/auto-racing-auto-racing-glance-092618,https://b.fssta.com/uploads/2016/12/default_image.vresize.1200.630.high.0.png
0,0.0,0,0.0,Alex Morrell,"Bank of America Merrill Lynch is set to report third-quarter earnings at about 6:45 a.m. Monday. Analysts expect the bank to report adjusted earnings per share of $US0.62, a 29.5% increase from last year. Here’s what else analysts will be expecting and watchi… [+740 chars]","Bank of America Merrill Lynch is set to report third-quarter earnings at about 6.45 a.m. Monday. Analysts expect the bank to report adjusted earnings per share of $US0.62, a 29.5% increase from last year. More »",2018-10-14T23:00:00Z,"{'id': None, 'name': 'Businessinsider.com.au'}",Here comes Bank of America...,https://www.businessinsider.com.au/bank-of-america-merrill-lynch-reports-q3-earnings-third-quarter-2018-10,https://static.businessinsider.com/image/5bc3ac0392b369118b3f5f63-640.jpg
4,-0.9999997500000625,0,0.09999999750000006,,"Tencent Music Entertainment has postponed its plans to go public amid a global equity sell-off this week led by technology shares, according to one person briefed on the matter. The music streaming company was being spun out of Tencent, an internet gaming, so… [+919 chars]","Tencent Music Entertainment has postponed its plans to go public amid a global equity sell-off this week led by technology shares, according to one person briefed on the matter.",2018-10-11T22:47:04Z,"{'id': 'financial-times', 'name': 'Financial Times'}",Tencent Music postpones IPO as market turmoil hits,https://www.ft.com/content/f84d10b4-cda6-11e8-b276-b9069bde0956,https://www.ft.com/__origami/service/image/v2/images/raw/http%3A%2F%2Fprod-upp-image-read.ft.com%2F33f18bde-c66f-11e8-ba8f-ee390057b8c9?source=next-opengraph&fit=scale-down&width=900
0,0.0,0,0.0,,"REUTERS: Visa Inc, Mastercard Inc, and a number of banks on Tuesday agreed to pay US$6.2 billion to settle a long-running lawsuit brought by merchants over the fees they pay when they accept card payments. The card issuers named in the class-action lawsuit in… [+543 chars]","Visa Inc, Mastercard Inc, and a number of banks on Tuesday agreed to pay US$6.2 billion to settle a long-running lawsuit brought by merchants over the fees they pay when they accept card payments.",2018-09-18T11:36:04Z,"{'id': None, 'name': 'Channelnewsasia.com'}","Visa, Mastercard reach US$6.2 billion settlement over card-swipe fees",https://www.channelnewsasia.com/news/business/visa--mastercard-reach-us-6-2-billion-settlement-over-card-swipe-fees-10733502,http://www.channelnewsasia.com/image/10733498/16x9/991/557/fe8137712de1f37ffb71746b040e4df3/XB/illustration-photo-of-a-mastercard-logo-on-a-credit-card-3.jpg
2,-0.99999950000025,0,0.07142856887755111,,"General Electric has paid more than $6bn in fees to Wall Street banks since the turn of the century, even as its market value has collapsed by 80 per cent over the period. The industrial conglomerates history of dealmaking was called into question on Monday a… [+4556 chars]",The industrial conglomerate has paid more than $6bn to Wall Street bankers since 2000,2018-10-02T04:02:20Z,"{'id': 'financial-times', 'name': 'Financial Times'}",GE’s dealmaking and outlay to M&A advisers questioned,https://www.ft.com/content/8a7c948c-c5c3-11e8-8167-bea19d5dd52e,https://www.ft.com/__origami/service/image/v2/images/raw/http%3A%2F%2Fprod-upp-image-read.ft.com%2Fb905b24e-c5d6-11e8-86b4-bfd556565bb2?source=next-opengraph&fit=scale-down&width=900
1,-0.9999990000010001,0,0.034482757431629055,AP,"By imposing tariffs on $200 billion more in Chinese goods starting next week, President Donald Trump has intensified his trade war with Beijing and triggered the likelihood of price increases for many American companies and consumers. Beijing has said it will… [+6520 chars]",Beijing has said it will swiftly retaliate against American exporters - a move that stands to hurt U.S.farmers and other companies that sell their products to China.,2018-09-18T05:44:09Z,"{'id': 'the-times-of-india', 'name': 'The Times of India'}","US-China tariffs: What's behind them, who stands to be hurt?",https://economictimes.indiatimes.com/news/international/business/us-china-tariffs-whats-behind-them-who-stands-to-be-hurt/articleshow/65852337.cms,"https://img.etimg.com/thumb/msid-65852460,width-1070,height-580,imgsize-250503,overlay-economictimes/photo.jpg"
0,0.0,0,0.0,The Clemson Insider,"Tickets for the 2018 Dr Pepper Atlantic Coast Conference Football Championship Game will go on sale to the public via Ticketmaster on Tuesday, Oct. 2, at 10 a.m. Tickets will be available online at Ticketmaster, and through the ACCs official website, theACC.c… [+1241 chars]","Tickets for the 2018 Dr Pepper Atlantic Coast Conference Football Championship Game will go on sale to the public via Ticketmaster on Tuesday, Oct. 2, at 10 a.m. Tickets will be available online at Ticketmaster, and through the ACC's official website, theACC.…",2018-09-27T16:52:01Z,"{'id': None, 'name': 'Theclemsoninsider.com'}",ACC Football Championship Game tickets on sale,https://theclemsoninsider.com/2018/09/27/acc-football-championship-game-tickets-on-sale/,https://usattci.files.wordpress.com/2018/06/dabo-swinney.jpg?w=1024&h=576&crop=1
0,0.0,0,0.0,Charlotte Mitchell,"Britain is due to leave the EU in six months' time, at 23:00 GMT on March 29, 2019. Here are five things to know: 1. Will Brexit definitely happen? The UK government remains committed to reaching an agreement with the EU before negotiations end in March, howe… [+9323 chars]",Will Brexit definitely happen? Is a trade deal expected? What will happen to migrants? How will the economy be affected?,2018-09-29T08:16:20Z,"{'id': 'al-jazeera-english', 'name': 'Al Jazeera English'}",Six months to go until Brexit: All you need to know,https://www.aljazeera.com/news/2018/09/months-brexit-180923173227311.html,https://www.aljazeera.com/mritems/Images/2018/9/28/e45c2ba07b944276b369e3fe291bf21b_18.jpg
1,0.599999880000024,4,0.12499999687500009,"Insights Team, Forbes Insights, Insights Team, Forbes Insights https://www.forbes.com/sites/insightsteam/","New market highs and booming stock sectors make for great headlines, but they mean little to investors unless they’re seeing the results in their portfolio. And the truth is, between low interest rates, tax complexity and lack of diversification, people often… [+11544 chars]","The secret to successful long-term investing hasn’t changed: Build a well-balanced portfolio across sectors and asset classes, while keeping an eye on taxes, fees and turnover.",2018-09-18T15:38:00Z,"{'id': None, 'name': 'Forbes.com'}",Closed-End Funds: A Better Alternative,https://www.forbes.com/sites/insights-nuveen/2018/09/18/closed-end-funds-a-better-alternative/,https://thumbor.forbes.com/thumbor/600x315/https%3A%2F%2Fblogs-images.forbes.com%2Finsights-nuveen%2Ffiles%2F2018%2F09%2FiStock-618196156-1200x801.jpg
0,0.9999990000010001,1,0.025641024983563465,"Rohit Arora, Contributor, Rohit Arora, Contributor https://www.forbes.com/sites/rohitarora/","Share to facebook Share to twitter Share to linkedin In this June 15, 2018 photo, twenty dollar bills are counted.&amp;nbsp; (AP Photo/Elise Amendola, File) Average annual revenue of Latino-owned business increased from $258,702 in 2016-17 to $327,189 in 2017… [+12313 chars]",Twenty-seven percent of Latino business owners were approved for funding during the last 12 months. It’s roughly the same percentage as the approval rates for non-Latino-owned businesses. Indeed the funding gap is shrinking.,2018-09-26T13:13:00Z,"{'id': None, 'name': 'Forbes.com'}",The Stunning Success Of Latino-Owned Businesses Spurs Entrepreneurship,https://www.forbes.com/sites/rohitarora/2018/09/26/the-stunning-success-of-latino-owned-businesses-spurs-entrepreneurship/,https://thumbor.forbes.com/thumbor/600x315/https%3A%2F%2Fspecials-images.forbesimg.com%2Fdam%2Fimageserve%2F95e96498a0d44e98a40470fbe0cb3df7%2F960x0.jpg%3Ffit%3Dscale
1,-0.9999990000010001,0,0.026315788781163457,"Richard Eisenberg, Contributor, Richard Eisenberg, Contributor https://www.forbes.com/sites/nextavenue/people/reisenberg/","Share to facebook Share to twitter Share to linkedin Credit: Getty Royalty Free Many millennials are having a tough time financially launching their adult lives and careers, what with the high cost of rent, student loans and health care, plus unreliable gig-e… [+12528 chars]",A new Merrill Lynch Age Wave study finds boomer and Gen X parents are giving their adult kids $500 billion a year in financial support.,2018-10-02T15:43:00Z,"{'id': None, 'name': 'Forbes.com'}",Parents' Support To Adult Kids: A Stunning $500 Billion A Year,https://www.forbes.com/sites/nextavenue/2018/10/02/parents-support-to-adult-kids-a-stunning-500-billion-a-year/,https://thumbor.forbes.com/thumbor/600x315/https%3A%2F%2Fspecials-images.forbesimg.com%2Fdam%2Fimageserve%2F979877166%2F960x0.jpg%3Ffit%3Dscale
0,0.0,0,0.0,SA Editor Liz Kiesche,"Bank of America's (NYSE: BAC ) head of corporate and investment banking, Christian Meissner is leaving the bank, the Wall Street Journal reports, citing an internal memo. He spent almost seven years in the role and led revamping the unit after the bank's fina… [+335 chars]","Bank of America's (NYSE:BAC) head of corporate and investment banking, Christian Meissner is leaving the bank, the Wall Street Journal reports, citing an internal memo.He spent almost seven years in t",2018-09-20T11:56:14Z,"{'id': None, 'name': 'Seekingalpha.com'}",Bank of America's corporate/investment banking head reportedly leaving: WSJ,https://seekingalpha.com/news/3391701-bank-americas-corporate-investment-banking-head-reportedly-leaving-wsj,https://static3.seekingalpha.com/assets/og_image_192-59bfd51c9fe6af025b2f9f96c807e46f8e2f06c5ae787b15bf1423e6c676d4db.png
2,-0.99999950000025,0,0.07407407133058995,Options Markets,"Financial stocks have recently broken out to near-term highs, and Bank of America ( BAC ) is trading at levels that have not been seen since the early parts of this year. Ironically, the back-and-forth activity in stock prices has put shareholders close to wh… [+5839 chars]","Financial stocks have recently broken out to near-term highs, and Bank of America is trading at levels not seen since the early parts of 2018. Further gains are",2018-09-26T19:39:55Z,"{'id': None, 'name': 'Seekingalpha.com'}",Bank Of America: Trump Vs. The Fed,https://seekingalpha.com/article/4208434-bank-america-trump-vs-fed,https://static3.seekingalpha.com/uploads/2018/9/25/saupload_WPB52xdGT_BMM-lm0H-Y7rN-IFmUWMVki5dgq1V-_1YFvNOI5b3XzK3JA9iYefEpGd02vpMPCmu2JP3C3erySyHeC4x8blk0yrChUuOOIUIygy633QJXihrvUawlR-5Mjks6dv_D_thumb1.png
1,0.0,1,0.08333332986111125,,"Wells Fargo on Thursday said it expects to reduce its workforce by about 5-10 per cent within the next three years, as the US bank continues its efficiency push and responds to changing customer behaviour. The company employs 265,000 people, which suggests th… [+2332 chars]",US bank says reduction will be made over the next three years,2018-09-20T19:30:08Z,"{'id': 'financial-times', 'name': 'Financial Times'}",Wells Fargo to cut workforce by up to 10%,https://www.ft.com/content/784cb4d8-bd06-11e8-8274-55b72926558f,https://www.ft.com/__origami/service/image/v2/images/raw/http%3A%2F%2Fprod-upp-image-read.ft.com%2F9b4ef3ee-bd09-11e8-8274-55b72926558f?source=next-opengraph&fit=scale-down&width=900
0,0.99999950000025,2,0.04651162682531101,Chuck,"The Offer Direct Link to offer Bank of America Preferred Rewards members can open a new Merrill Edge cash management or IRA account and get the following bonus tiers when you use offer code 900ME : Transfer $200,000 or more and get a $900 bonus (standard is $… [+5974 chars]","Bank of America Preferred Rewards members can open a new Merrill Edge cash management or IRA account and get the following bonus tiers when you use offer code 900ME: Transfer $200,000 or more and get a $900 bonus (standard is $600) Transfer $100,000 or more a…",2018-09-23T12:00:08Z,"{'id': None, 'name': 'Doctorofcredit.com'}",Merrill Edge Brokerage: Up To $900 Cash Bonus for Moving Over your Investments,https://www.doctorofcredit.com/merrill-edge-brokerage-up-to-900-cash-bonus-for-moving-over-your-investments/,https://www.doctorofcredit.com/wp-content/uploads/2018/09/Screen-Shot-2018-09-23-at-1.24.09-AM.png
0,0.9999998333333611,6,0.16666666203703717,"Shep McAllister on Points, shared by Shep McAllister to The Inventory","As we’ve covered before, cash back cards and travel rewards credit cards are very different beasts, but the Bank of America Premium Rewards credit card combines aspects of both. It probably wouldn’t be my first choice of card, but if you have Bank of America … [+4112 chars]","As we’ve covered before, cash back cards and travel rewards credit cards are very different beasts, but the Bank of America Premium Rewards credit card combines aspects of both. It probably wouldn’t be my first choice of card, but if you have Bank of America …",2018-09-17T17:00:00Z,"{'id': None, 'name': 'Theinventory.com'}","Bank of America's Premium Rewards Card Is Good For Everyone, and Great for Some",https://points.theinventory.com/bank-of-americas-premium-rewards-card-is-good-for-every-1828975207,"https://i.kinja-img.com/gawker-media/image/upload/s--WTVlEZ9W--/c_fill,fl_progressive,g_center,h_900,q_80,w_1600/dgrrgyrj6lp9mwt7r7e0.jpg"
3,-0.9999996666667778,0,0.08333333101851859,Sujata Rao,"LONDON/NEW YORK (Reuters) - Amid all the brickbats thrown at one of the longest bull markets in history, the remarkable buoyancy of world equity prices may simply be down to a shortage of shares. Trade wars, an unpredictable White House, a messy Brexit and ri… [+5806 chars]","Amid all the brickbats thrown at one of the longest bull markets in history, the remarkable buoyancy of world equity prices may simply be down to a shortage of shares.",2018-09-26T13:24:07Z,"{'id': 'reuters', 'name': 'Reuters'}",Death of equity keeps stock market bull alive,https://www.reuters.com/article/us-stocks-supply-shrinkage-analysis/death-of-equity-keeps-stock-market-bull-alive-idUSKCN1M61SI,https://s2.reutersmedia.net/resources/r/?m=02&d=20180926&t=2&i=1308388829&w=1200&r=LYNXNPEE8P1BD
4,-0.1428571224489825,3,0.1590909054752067,Lucia Mutikani,"WASHINGTON (Reuters) - Sales of new U.S. single-family homes rebounded in August after two straight monthly declines, but the underlying trend still pointed to a weakening housing market against the backdrop of rising mortgage rates and higher home prices. Th… [+3895 chars]","Sales of new U.S. single-family homes rebounded in August after two straight monthly declines, but the underlying trend still pointed to a weakening housing market against the backdrop of rising mortgage rates and higher home prices.US",2018-09-26T16:14:07Z,"{'id': 'reuters', 'name': 'Reuters'}","U.S. new home sales rebound, but trend weakening",https://www.reuters.com/article/us-usa-economy-housing/u-s-new-home-sales-rebound-but-trend-weakening-idUSKCN1M61Y0,https://s3.reutersmedia.net/resources/r/?m=02&d=20180926&t=2&i=1308414822&w=1200&r=LYNXNPEE8P1FL
7,-0.9999998571428775,0,0.1666666626984128,"Morgan Simon, Contributor, Morgan Simon, Contributor https://www.forbes.com/sites/morgansimon/","Share to facebook Share to twitter Share to linkedin Mom's Rising Daniel Schwartz The two largest private prison companies, CoreCivic and GeoGroup, have over $2BN a year in ICE contracts, managing some of the detention centers that have been at the heart of t… [+15261 chars]","The two largest private prison companies have over $2BN a year in ICE contracts, managing some of the detention centers that have been at the heart of the controversy over the separation of families and incarceration of individuals for crossing the US border.…",2018-09-25T19:42:00Z,"{'id': None, 'name': 'Forbes.com'}",What Do Big Banks Have To Do With Family Detention? #FamiliesBelongTogether Explains,https://www.forbes.com/sites/morgansimon/2018/09/25/what-do-big-banks-have-to-do-with-family-detention-familiesbelongtogether-explains/,https://thumbor.forbes.com/thumbor/600x315/https%3A%2F%2Fblogs-images.forbes.com%2Fmorgansimon%2Ffiles%2F2018%2F09%2Fi-cPRqjkh-X4-1200x800.jpg
0,0.99999950000025,2,0.05263157756232691,"Peter Cohan, Contributor, Peter Cohan, Contributor https://www.forbes.com/sites/petercohan/",Share to facebook Share to twitter Share to linkedin woman touching an illuminated digital network There are plenty of startups going after the business of business intelligence. What companies want is to find a needle of insight in a haystack of data -- both… [+12618 chars],"With $166 billion in business intelligence spending, there seems to be enough to go around for Tableau and a trio of upstarts: Arcadia, Looker, and ThoughtSpot.",2018-10-02T14:24:00Z,"{'id': None, 'name': 'Forbes.com'}","Startup Targets Tableau, IBM In $166B Business Intelligence Mart",https://www.forbes.com/sites/petercohan/2018/10/02/startup-targets-tableau-ibm-in-166b-business-intelligence-mart/,https://thumbor.forbes.com/thumbor/600x315/https%3A%2F%2Fspecials-images.forbesimg.com%2Fdam%2Fimageserve%2F833383456%2F960x0.jpg%3Ffit%3Dscale
9,-0.7999999200000081,1,0.23255813412655504,Nick Cunningham,"An oil price spike is starting to look increasingly possible, with a rerun of 2008 not entirely out of the question, according to a new report. The outages from Iran are worse than most analysts expected, and bottlenecks in the U.S. shale patch could prevent … [+6402 chars]","An oil price spike is starting to look increasingly possible, with a rerun of 2008 not entirely out of the question, according to a new report. The outages from Iran are worse than most analysts expected, and bottlenecks in the … The post Towards an Oil Price…",2018-09-26T15:27:08Z,"{'id': None, 'name': 'Globalresearch.ca'}",Towards an Oil Price Spike? $100 Oil a Barrel Is a Distinct Possibility,https://www.globalresearch.ca/towards-an-oil-price-spike-100-oil-a-barrel-is-a-distinct-possibility/5655262,https://www.globalresearch.ca/wp-content/uploads/2018/09/2bfb9b1edd5efd7fecb6dbb92580e0e1.jpg
