Negative,Polarity,Positive,Subjectivity,author,content,description,publishedAt,source,title,url,urlToImage
3,0.24999996875000394,5,0.18181817768595052,https://www.dailymail.co.uk/home/search.html?s=&authornamef=Reuters,"Oct 15 (Reuters) - Bank of America Corp reported a 35 percent rise in quarterly profit on Monday as the second-largest U.S. lender benefited from tax cuts, while growth in lending helped it offset lower bond trading revenue. Net income applicable to common sh… [+514 chars]","Oct 15 (Reuters) - Bank of America Corp reported a  35 percent rise in quarterly profit on Monday as the  second-largest U.S. lender benefited from tax cuts,...",2018-10-15T11:02:57Z,"{'id': 'daily-mail', 'name': 'Daily Mail'}","Bank of America profit rises 35 pct on tax cuts, loan...",https://www.dailymail.co.uk/wires/reuters/article-6277349/Bank-America-profit-rises-35-pct-tax-cuts-loan-growth.html,https://i.dailymail.co.uk/i/pix/m_logo_636x382px.png
2,-0.99999950000025,0,0.060606058769513374,newsfeedback@fool.com (Motley Fool Transcription),"Image source: The Motley Fool. ConAgra Brands, Inc. ( NYSE:CAG ) Q1 2019 Earnings Conference Call Sept. 27, 2018, 9:30 a.m. ET Contents: Prepared Remarks Questions and Answers Call Participants Prepared Remarks: Operator Good day, and welcome to the ConAgra B… [+52369 chars]","CAG earnings call for the period ending August 31, 2018.",2018-09-27T14:47:00Z,"{'id': None, 'name': 'Fool.com'}","ConAgra Brands, Inc. (CAG) Q1 2019 Earnings Conference Call Transcript",https://www.fool.com/earnings/call-transcripts/2018/09/27/conagra-brands-inc-cag-q1-2019-earnings-conference.aspx,https://g.foolcdn.com/image/?url=https%3A%2F%2Fg.foolcdn.com%2Feditorial%2Fimages%2F495645%2Ftranscripts-logo.png&h=630&w=1200&op=resize
2,-0.99999950000025,0,0.057142855510204135,newsfeedback@fool.com (Motley Fool Transcription),"Image source: The Motley Fool. Pepsico, Inc. ( NASDAQ:PEP ) Q3 2018 Earnings Conference Call October 2, 2018, 7:45 a.m. ET Contents: Prepared Remarks Questions and Answers Call Participants Prepared Remarks: Operator Good morning and welcome to PepsiCo's thir… [+53810 chars]","PEP earnings call for the period ending September 30, 2018.",2018-10-02T13:15:00Z,"{'id': None, 'name': 'Fool.com'}","Pepsico, Inc. (PEP) Q3 2018Earnings Conference Call Transcript",https://www.fool.com/earnings/call-transcripts/2018/10/02/pepsico-inc-pep-q3-2018earnings-conference-call-tr.aspx,https://g.foolcdn.com/image/?url=https%3A%2F%2Fg.foolcdn.com%2Feditorial%2Fimages%2F495995%2Ftranscripts-logo.png&h=630&w=1200&op=resize
1,0.0,1,0.06249999804687507,https://www.dailymail.co.uk/home/search.html?s=&authornamef=Reuters,"By Elisa Anzolin and Stephen Jewkes MILAN, Oct 5 (Reuters) - Italy's Salini Impregilo is working with Bank of America Merrill Lynch and advisers Vitale &amp;amp; Co on options for a possible full or partial takeover of troubled builder Astaldi, sources close … [+2622 chars]","By Elisa Anzolin and Stephen JewkesMILAN, Oct 5 (Reuters) - Italy's Salini Impregilo  is working with Bank of America Merrill Lynch and  advisers Vitale...",2018-10-05T13:47:09Z,"{'id': 'daily-mail', 'name': 'Daily Mail'}",Italian construction group Salini looks at possible...,https://www.dailymail.co.uk/wires/reuters/article-6244325/Italian-construction-group-Salini-looks-possible-Astaldi-deal-sources.html,https://i.dailymail.co.uk/i/pix/m_logo_636x382px.png
0,0.0,0,0.0,https://www.dailymail.co.uk/home/search.html?s=&authornamef=Reuters,"By David Henry NEW YORK, Oct 11 (Reuters) - JPMorgan Chase &amp;amp; Co and Bank of America Corp have placed the jobs of chairman and chief executive in the hands of one person, and now No. 3 Citigroup Inc must decide whether to follow suit. The matter will b… [+4233 chars]","By David HenryNEW YORK, Oct 11 (Reuters) - JPMorgan Chase & Co and  Bank of America Corp  have placed the jobs of chairman  and chief executive in the...",2018-10-11T05:02:55Z,"{'id': 'daily-mail', 'name': 'Daily Mail'}",Chairman and CEO together or separate? Citigroup has to...,https://www.dailymail.co.uk/wires/reuters/article-6263739/Chairman-CEO-separate-Citigroup-decide.html,https://i.dailymail.co.uk/i/pix/m_logo_636x382px.png
3,-0.49999987500003124,1,0.11428571102040827,Corrie Driebusch,"U.S. stocks suffered their biggest decline in more than seven months Wednesday, as investors accelerated their retreat from fast-growing technology stocks in favor of shares that have been overlooked. Major indexes have started the fourth quarter on their wea… [+5058 chars]","Wall Street Journal Quickening Retreat From Tech Sinks Market Wall Street Journal The rotation out of tech and other growth stocks—among the most popular trades of the year—to so-called safety stocks, such as utilities companies, was sparked in part by the re…",2018-10-10T19:30:28Z,"{'id': 'the-wall-street-journal', 'name': 'The Wall Street Journal'}",Quickening Retreat From Tech Sinks Market - Wall Street Journal,https://www.wsj.com/articles/quickening-retreat-from-tech-sinks-market-1539199786,https://images.wsj.net/im-30298/social
1,0.0,1,0.04545454442148763,Cincinnati.com,"Joe Mixon on his knee surgery and view of the two-to-four week timetable. Paul Dehner Jr., pdehnerjr@enquirer.com Carolina Panthers linebacker Luke Kuechly (59) jogs to the practice field at Bank of America Stadium on May 25. (Photo: Jeremy Brevard-USA TODAY … [+3986 chars]",Joe Mixon on his knee surgery and view of the two-to-four week timetable. The Bengals (2-0) and Panthers (1-1) kick off at 1 p.m. on Sunday. Carolina is coming off a 31-24 loss at the Atlanta Falcons. The Bengals stayed perfect on the season with a 34-23 vict…,2018-09-20T02:50:40Z,"{'id': None, 'name': 'Cincinnati.com'}","TV, odds, history, uniforms and more",https://www.cincinnati.com/story/sports/nfl/bengals/2018/09/19/cincinnati-bengals-carolina-panthers-tv-odds-history-and-more/1358893002/?utm_source=google&utm_medium=amp&utm_campaign=speakable,https://www.gannett-cdn.com/-mm-/a5076e7a43a0cec6129489319d0fb728e2cd1814/c=0-264-5184-3193/local/-/media/2017/06/23/Cincinnati/Cincinnati/636338250308182243-USATSI-10072634.jpg?width=3200&height=1680&fit=crop
5,-0.4285713673469475,2,0.14583333029513895,Tom Boggioni,A popular columnist writing for Maine’s largest newspaper didn’t have a lot of sympathy for embattled Republican Senator Susan Collins’ complaints about the over $3.6 million raised for her 2020 opponent. With Collins telling reporters that she feels the mone… [+3261 chars],A popular columnist writing for Maine’s largest newspaper didn’t have a lot of sympathy for embattled Republican Senator Susan Collins’ complaints about the over $3.6 million raised for her 2020 opponent. With Collins telling reporters that she feels the mone…,2018-10-11T18:47:22Z,"{'id': None, 'name': 'Rawstory.com'}",Maine columnist ridicules Susan Collins’ complaint about opposition fundraising by naming her big bucks contributors,https://www.rawstory.com/2018/10/maine-columnist-ridicules-susan-collins-complaint-opposition-fundraising-naming-big-bucks-contributors/,https://www.rawstory.com/wp-content/uploads/2018/10/collins-2-800x430.jpg
5,-0.99999980000004,0,0.09999999800000005,,"When Nikki Haley announced she would resign as U.S. ambassador to the United Nations at the end of the year, rumors swirled around her potential 2020 ambitions and next move out of President Trumps administration. But her decision to resign also put a spotlig… [+6224 chars]","Yahoo News Nikki Haley's Resignation Puts A Spotlight on Her Debt. Here's What We Know About Her Money Yahoo News When Nikki Haley announced she would resign as U.S. ambassador to the United Nations at the end of the year, rumors swirled around her potential …",2018-10-11T01:59:13Z,"{'id': None, 'name': 'Yahoo.com'}",Nikki Haley's Resignation Puts A Spotlight on Her Debt. Here's What We Know About Her Money - Yahoo News,https://finance.yahoo.com/news/nikki-haley-apos-resignation-puts-183542331.html,https://s.yimg.com/uu/api/res/1.2/u8RtLCAHZZvtitGrr6WjdA--~B/aD0zMzY2O3c9NTA0OTtzbT0xO2FwcGlkPXl0YWNoeW9u/http://media.zenfs.com/en-US/homerun/money_403/ccacb7379fddff16b35597038a2c25ff
4,-0.9999997500000625,0,0.10256409993425386,Akin Oyedele,"The top is in for existing-home sales, which make up 90% of transactions in the US, according to economists at Bank of America Merrill Lynch. They cite worsening affordability, higher mortgage rates, and price cuts as reasons why sales are unlikely to bounce … [+2678 chars]","The top is in for existing-home sales, which make up 90% of transactions in the US, according to economists at Bank of America Merrill Lynch. They cite worsening affordability, higher mortgage rates, and price cuts as reasons why sales are unlikely to bounce …",2018-09-24T03:21:00Z,"{'id': None, 'name': 'Businessinsider.com.au'}",BANK OF AMERICA: The most important segment of the housing market has peaked,https://www.businessinsider.com.au/housing-market-existing-home-sales-have-peaked-bank-of-america-2018-9,https://static.businessinsider.com/image/5ba8e32be55aa8553f8b4567-640.jpg
0,0.0,0,0.0,Jaclyn Gallucci,"Online-polling company SurveyMonkey raised $180 million in an upsized initial public offering, selling the shares above the marketed price range. SurveyMonkey, the operating name of Svmk Inc., sold 15 million shares for $12 apiece after earlier offering 13.5 … [+1953 chars]",Online-polling company SurveyMonkey raised $180 million in an upsized initial public offering.,2018-09-26T15:27:38Z,"{'id': 'fortune', 'name': 'Fortune'}",SurveyMonkey Raises $180 Million in U.S. IPO,http://fortune.com/2018/09/26/surveymonkey-ipo/,https://fortunedotcom.files.wordpress.com/2018/09/surveymonkey-e1537975625897.jpg
0,0.0,0,0.0,SA Editor Carl Surran,"Stocks finished mixed, with the Dow and S&amp;P 500 pushing forward near fresh records while the Nasdaq and Russell 2000 edged lower. The financial group (+1.8%) led all S&amp;P sectors as Treasury yields rose across the curve, with the 10-year yield rising 3… [+822 chars]","Stocks finished mixed, with the Dow and S&amp;P 500 pushing forward near fresh records while the Nasdaq and Russell 2000 edged lower. The financial group (+1.8%) led all S&amp;P sectors as Treasury y",2018-09-19T21:00:07Z,"{'id': None, 'name': 'Seekingalpha.com'}",Dow keeps climbing as bank shares surge; other indexes little changed,https://seekingalpha.com/news/3391616-dow-keeps-climbing-bank-shares-surge-indexes-little-changed,https://static3.seekingalpha.com/assets/og_image_192-59bfd51c9fe6af025b2f9f96c807e46f8e2f06c5ae787b15bf1423e6c676d4db.png
0,0.0,0,0.0,Harris Oakmark,Oakmark Equity and Income Fund Investor Class Average Annual Total Returns (09/30/18) Since Inception (11/01/95) 10.08% 10year 7.51% 5year 6.99% 1year 5.29% 3month 2.46% Gross Expense Ratio as of 09/30/17 was 0.87% Net Expense Ratio as of 09/30/17 was 0.78% P… [+14315 chars],Oakmark Equity and Income Fund – Investor Class Average Annual Total Returns (09/30/18)Since Inception (11/01/95) 10.08%10–year 7.51%5–year 6.99%1–year 5.29%3–m,2018-10-08T11:00:26Z,"{'id': None, 'name': 'Seekingalpha.com'}",Oakmark Equity And Income Fund: Third Quarter 2018,https://seekingalpha.com/article/4210351-oakmark-equity-income-fund-third-quarter-2018,https://static3.seekingalpha.com/assets/og_image_192-59bfd51c9fe6af025b2f9f96c807e46f8e2f06c5ae787b15bf1423e6c676d4db.png
0,0.9999990000010001,1,0.020833332899305567,SA Editor Liz Kiesche,"Goldman Sachs (NYSE: GS ) gains 2.4% in midday trading amid news that it's promoting Dan Dees to help run Wall Street's top investment-banking operation and that rivals are lining up to take stakes in its ""Simon"" investing app. Dan Dees, who currently leads t… [+1020 chars]",Goldman Sachs (NYSE:GS) gains 2.4%&nbsp;in midday trading amid news that it's&nbsp; promoting Dan Dees to help run Wall Street's top investment-banking operation and that rivals are lining up to take,2018-09-19T15:46:33Z,"{'id': None, 'name': 'Seekingalpha.com'}","Goldman +2.4% as new investment co-chief named, investing app developments",https://seekingalpha.com/news/3391490-goldman-plus-2_4-percent-new-investment-co-chief-picked-investing-app-developments,https://static3.seekingalpha.com/assets/og_image_192-59bfd51c9fe6af025b2f9f96c807e46f8e2f06c5ae787b15bf1423e6c676d4db.png
0,0.0,0,0.0,SA Editor Liz Kiesche,Digital Realty (DLR ) starts a public offering of 8.5M shares of common stock in connection with forward sales agreements to fund its portion of the recently announced $1.8B acquisition of Ascenty. The company plans to enter into forward sales agreements with… [+835 chars],Digital Realty (DLR) starts a public offering of 8.5M shares of common stock in connection with forward sales agreements to fund its portion of the recently announced $1.8B acquisition of Ascenty.The,2018-09-24T11:37:15Z,"{'id': None, 'name': 'Seekingalpha.com'}",Digital Realty starts 8.5M-share stock offering,https://seekingalpha.com/news/3392344-digital-realty-starts-8_5m-share-stock-offering,https://static3.seekingalpha.com/assets/og_image_192-59bfd51c9fe6af025b2f9f96c807e46f8e2f06c5ae787b15bf1423e6c676d4db.png
0,0.0,0,0.0,SA Editor Clark Schultz,"Online fashion retailer Revolve ( RVLV ) files for an $100M IPO in July Revolve calls itself the next-generation fashion retailer for millennial consumers. ""Our dynamic platform connects a deeply engaged community of millions of consumers, thousands of global… [+936 chars]",Online fashion retailer Revolve (RVLV) files for an $100M IPO in July Revolve calls itself the next-generation fashion retailer for millennial consumers. &#34;Our dynamic platform connects a deeply e,2018-10-01T12:28:12Z,"{'id': None, 'name': 'Seekingalpha.com'}",Online fashion player Revolve files for IPO,https://seekingalpha.com/news/3393989-online-fashion-player-revolve-files-ipo,https://static3.seekingalpha.com/assets/og_image_192-59bfd51c9fe6af025b2f9f96c807e46f8e2f06c5ae787b15bf1423e6c676d4db.png
3,0.1428571224489825,4,0.16279069388858852,Jeff Cox,"But as the Fed and others end asset purchases and gradually raise rates, investors will have to brace for significant changes, Hartnett wrote. In that climate, he advised investors to focus on ""inequality, innovation and immortality,"" that would benefit pharm… [+2466 chars]","The ""Great Bull"" market that came after the financial crisis is dead due to slowing economic growth, rising interest rates and too much debt, according to a Bank of America Merrill Lynch analysis.",2018-09-19T15:59:00Z,"{'id': 'cnbc', 'name': 'CNBC'}","The 'Great Bull' market is 'dead,' and here's what's next, Bank of America Merrill Lynch predicts",https://www.cnbc.com/2018/09/19/the-great-bull-market-is-dead-and-heres-whats-next-bank-of-america-strategist-says.html,https://fm.cnbc.com/applications/cnbc.com/resources/img/editorial/2013/03/05/100524683-wall-street-bull-close-up-getty.1910x1000.jpg
2,-0.99999950000025,0,0.060606058769513374,Geraldine Gittens,"Stewarts driver called into The Kitchen Whisk, a cookware shop on Wicklow street in Dublin, to alert them that a famous customer was about to walk through their doors. The cook was in Dublin to speak at the Bank of America-backed Global Forum for women busine… [+701 chars]",America’s queen of cooking Martha Stewart surprised a Dublin shop this week when she popped in for some baking purchases.,2018-10-12T12:54:46Z,"{'id': None, 'name': 'Independent.ie'}",'We were told someone quite famous is about to come in' - Martha Stewart makes surprise visit to Dublin shop,https://www.independent.ie/life/food-drink/we-were-told-someone-quite-famous-is-about-to-come-in-martha-stewart-makes-surprise-visit-to-dublin-shop-37413672.html,https://www.independent.ie/incoming/article37413700.ece/ALTERNATES/h342/martha1.PNG
2,-0.99999950000025,0,0.05128204996712693,Bloomberg News,"(Bloomberg)—Visa Inc. and Mastercard Inc. agreed to pay as much as $6.2 billion to end a long-running price-fixing case brought by merchants over card fees, the largest-ever class action settlement of an antitrust case. The total is in line with sums the two … [+2583 chars]","(Bloomberg)—Visa Inc. and Mastercard Inc. agreed to pay as much as $6.2 billion to end a long-running price-fixing case brought by merchants over card fees, the largest-ever class action settlement of an antitrust case. The total is in line with sums the two …",2018-09-18T16:11:40Z,"{'id': None, 'name': 'Digitalcommerce360.com'}",Visa and Mastercard reach $6.2 billion settlement on swipe fees,https://www.digitalcommerce360.com/2018/09/18/visa-and-mastercard-reach-6-2-billion-settlement-on-swipe-fees/,https://www.digitalcommerce360.com/wp-content/uploads/2018/09/shutterstock_51417601-1024x493.png
0,0.0,0,0.0,Alex Butler,Sept. 26 (UPI) -- The Carolina Panthers have acquired offensive tackle Marshall Newhouse in a trade with the Buffalo Bills. Carolina announced the move on Tuesday. The Panthers waived tackle Corey Robinson in a corresponding roster move. The Bills picked up a… [+908 chars],The Carolina Panthers have acquired offensive tackle Marshall Newhouse in a trade with the Buffalo Bills.,2018-09-26T15:29:17Z,"{'id': None, 'name': 'Upi.com'}",Panthers trade for Bills T Marshall Newhouse,https://www.upi.com/Sports_News/NFL/2018/09/26/Panthers-trade-for-Bills-T-Marshall-Newhouse/4551537974175/,https://cdnph.upi.com/sv/ph/og/upi/4551537974175/2018/1/35e6a2d508b2258624dd9a7b8c53b96b/v1.5/Panthers-trade-for-Bills-T-Marshall-Newhouse.jpg
0,0.0,0,0.0,Alex Butler,"Sept. 27 (UPI) -- The Carolina Panthers have signed safety Eric Reid. Carolina announced the one-year deal on Thursday. ""Eric has been a starting safety in the NFL and has played at a high level throughout his career,"" general manager Marty Hurney said. ""Afte… [+1057 chars]",The Carolina Panthers have signed safety Eric Reid.,2018-09-27T16:32:42Z,"{'id': None, 'name': 'Upi.com'}",Carolina Panthers sign S Eric Reid,https://www.upi.com/Sports_News/NFL/2018/09/27/Carolina-Panthers-sign-S-Eric-Reid/1241538063749/,https://cdnph.upi.com/sv/ph/og/upi_com/1241538063749/2018/1/c5c9e4da0c83b45f16da92a84ffc3754/v1.5/Carolina-Panthers-sign-S-Eric-Reid.jpg
1,0.0,1,0.08333332986111125,Robert Armstrong,"Robert Armstrong Third quarter revenues at Bank of America came in just ahead of analysts estimates, growing 4 per cent to $22.8 billion, thanks to a good performance from retail banking. Consumer loans grew 6 per cent, bucking an industry trend of sluggish a… [+1036 chars]",Lower tax rate sees profits jump 33% to $7.2bn in third quarter,2018-10-15T13:01:35Z,"{'id': 'the-irish-times', 'name': 'The Irish Times'}",Retail banking drives Bank of America forward,https://www.irishtimes.com/business/financial-services/retail-banking-drives-bank-of-america-forward-1.3664081,https://www.irishtimes.com/image-creator/?id=1.3664079&origw=1440
9,-0.9999998888889013,0,0.19999999555555567,,"From: Bank of America onlinebanking@alerts.com Date: Saturday, 22 September 2018, 08:44AM +01:00 Subject: Activities Alert bankofamerica.com Due to several invalid logon attempt from a different location Your security is important to us. If you did not author… [+1517 chars]","The ""Invalid Logon Activities"" email activity alert below, which appears as if it came from Bank of America (BOA) is a phishing scam that is being sent to potential victims by cybercriminals. The phishing email has been created by cybercriminals to steal Bank…",2018-09-23T17:59:00Z,"{'id': None, 'name': 'Onlinethreatalerts.com'}","The ""Bank of America Invalid Logon Activities Alert"" Phishing Scam",https://www.onlinethreatalerts.com/article/2018/9/23/the-bank-of-america-invalid-logon-activities-alert-phishing-scam/,https://www.onlinethreatalerts.com/article/2018/9/23/the-bank-of-america-invalid-logon-activities-alert-phishing-scam/0.jpg
4,-0.9999997500000625,0,0.09090908884297526,,"From: Bank of America &lt;srerlokrs@usaaloginre.com&gt; Date: September 25, 2018 at 6:43:30 AM CDT Subject: Revision to Your Bank of America Account Bank of America® Dear We noticed some unusual activity on your account and are concerned about potential unaut… [+1473 chars]","The ""Revision to Your Bank of America Account"" email below, which appears to be a Bank of America activity alert, claiming BOA detected unusual activities on the recipients' online accounts, is a phishing scam. The fake email is being sent by cybercriminals, …",2018-09-25T16:44:00Z,"{'id': None, 'name': 'Onlinethreatalerts.com'}","The ""Revision to Your Bank of America Account"" Phishing Scam",https://www.onlinethreatalerts.com/article/2018/9/25/the-revision-to-your-bank-of-america-account-phishing-scam/,https://www.onlinethreatalerts.com/article/2018/9/25/the-revision-to-your-bank-of-america-account-phishing-scam/0.jpg
2,-0.99999950000025,0,0.06666666444444451,Nicolle Monico,"Nicolle Monico / September 18, 2018 Photo Credit: Bank of America Chicago Marathon On Sunday, October 7, the 41st Bank of America Chicago Marathon will take place along 26.2 miles of city streets and finishing in Grant Park. Each year, some of the world’s bes… [+5784 chars]","The most memorable, interesting, tragic and record-breaking Chicago Marathon moments of the last 10 years. Read the full article at Top Chicago Marathon Moments of the Last 10 Years on Competitor Running.",2018-09-18T14:45:05Z,"{'id': None, 'name': 'Competitor.com'}",Top Chicago Marathon Moments of the Last 10 Years,https://running.competitor.com/2018/09/chicago-marathon/top-chicago-marathon-moments-of-the-last-10-years_175099,https://s27691.pcdn.co/wp-content/uploads/2018/09/hero-9.jpg
0,0.0,0,0.0,,"Bank of America customer should always go directly to https://www.bankofamerica.com/ and sign into their account from there. Once they are signed, they will be notified of important changes or updates if there is any. From: BofA &lt;0EENrR.eTV804e80X48ZC84b49… [+1409 chars]",Bank of America (BofA) who have received the email below are asked not to click the link in it. This is because the email is a fake being sent by cybercriminals. Clicking the link goes to a fake BofA website that steals account credentials if visitors attempt…,2018-10-11T17:52:00Z,"{'id': None, 'name': 'Onlinethreatalerts.com'}","The ""Bank of America Security and Protection"" Phishing Scam",https://www.onlinethreatalerts.com/article/2018/10/11/the-bank-of-america-security-and-protection-phishing-scam/,https://www.onlinethreatalerts.com/article/2018/10/11/the-bank-of-america-security-and-protection-phishing-scam/0.jpg
2,-0.99999950000025,0,0.06666666444444451,Jeff Stein,"WASHINGTON — Senator Bernie Sanders of Vermont is proposing legislation that would place a hard cap on the size of financial institutions, a proposal that would splinter Wall Street’s biggest firms in an effort to ward off future taxpayer bailouts. The measur… [+3265 chars]",The Vermont senator is proposing legislation to cap the size of financial institutions.,2018-10-03T23:23:27Z,"{'id': None, 'name': 'Bostonglobe.com'}",Bernie Sanders to launch plan to break up Wall Street giants,https://www.bostonglobe.com/business/2018/10/03/bernie-sanders-launch-plan-break-wall-street-giants/r8NSV2V5JiRNZqjgzZZGUM/story.html,https://www.bostonglobe.com/rf/image_585w/Boston/2011-2020/2018/10/03/BostonGlobe.com/Business/Images/1stld-writethru-0aa63cb8-b123-11e8-a20b-5f4f84429666.jpg
3,-0.9999996666667778,0,0.09999999666666677,Matt Giles,"September 2008 was a whirlwind month for Michael Grynbaum, then a markets reporter for the New York Times. A self-described “newbie” to the paper’s business desk (he had previously worked on the metro desk), Grynbaum was immediately thrust into reporting on a… [+7907 chars]",The continuation of the false narrative of what caused the 2008 financial collapse is alarming.,2018-10-02T15:00:30Z,"{'id': None, 'name': 'Longreads.com'}",Did We Learn Nothing From the 2008 Crisis?,https://longreads.com/2018/10/02/did-we-learn-nothing-from-the-2008-crisis/,https://longreadsblog.files.wordpress.com/2018/10/ap_18067603796737.jpg?w=1200
0,0.99999950000025,2,0.06666666444444451,Reuters News,,"Private equity firm CVC has chosen Barclays (BARC.L), Bank of America Merrill Lynch (BAC.N) and Credit Suisse (CSGN.S) to lead the initial public offering of warranty provider Domestic & General in London, sources told Reuters.",2018-09-20T16:21:10Z,"{'id': None, 'name': 'Pehub.com'}","CVC selects banks to lead Domestic & General float, say sources: Reuters",https://www.pehub.com/2018/09/cvc-selects-banks-to-lead-domestic-general-float-say-sources-reuters/,
2,-0.99999950000025,0,0.054054052593133714,,"Investors pulled more than $6bn from junk bonds in the past week on concerns about highly indebted companies after a rise in interest rates. This was the largest outflow since a previous bout of market tumult in February, according to net redemption figures b… [+3268 chars]",Net redemptions jump to $6.1bn over concerns on higher rates,2018-10-11T23:03:33Z,"{'id': 'financial-times', 'name': 'Financial Times'}",Investors retreat from junk bonds in ‘risk-off’ move,https://www.ft.com/content/dd1f101e-cd9a-11e8-b276-b9069bde0956,https://www.ft.com/__origami/service/image/v2/images/raw/http%3A%2F%2Fprod-upp-image-read.ft.com%2F55ba4924-cda7-11e8-8d0b-a6539b949662?source=next-opengraph&fit=scale-down&width=900
