Negative,Polarity,Positive,Subjectivity,author,content,description,publishedAt,source,title,url,urlToImage
3,-0.49999987500003124,1,0.10810810518626743,"JJ Kinahan, Contributor, JJ Kinahan, Contributor https://www.forbes.com/sites/jjkinahan/",Share to facebook Share to twitter Share to linkedin The first full week of earnings gets underway today with the investors perhaps still wiping their collective brow from all the ups and (mostly) downs of the last few sessions. Stocks fell 4% last week in th… [+21403 chars],"The question going into the new week is whether the market can shake off memories of last week’s sharp losses, or if there’s more selling to come. Key bank earnings continue, while other sectors also start to see company reports as the week advances. Retail s…",2018-10-15T13:45:00Z,"{'id': None, 'name': 'Forbes.com'}",New Week Begins But Markets Still Seem To Be Playing Defense As Earnings Loom,https://www.forbes.com/sites/jjkinahan/2018/10/15/new-week-begins-but-markets-still-seem-to-be-playing-defense-as-earnings-loom/,https://thumbor.forbes.com/thumbor/600x315/https%3A%2F%2Fspecials-images.forbesimg.com%2Fdam%2Fimageserve%2F38662717%2F960x0.jpg%3Ffit%3Dscale
4,-0.9999997500000625,0,0.07692307544378701,,"LONDON: Investors cut equity exposure this month as they grew more wary that economic growth may slow, but kept a long-standing preference for mega-cap tech stocks, Bank of America Merrill Lynch's monthly survey indicated on Tuesday. BAML's September survey f… [+3605 chars]","Investors cut equity exposure this month as they grew more wary that economic growth may slow, but kept a long-standing preference for mega-cap tech stocks, Bank of America Merrill Lynch's monthly survey indicated on Tuesday.",2018-09-18T12:25:50Z,"{'id': None, 'name': 'Channelnewsasia.com'}",Investors raise cash buffers as gloom gathers over global economy: BAML survey,https://www.channelnewsasia.com/news/business/investors-raise-cash-buffers-as-gloom-gathers-over-global-economy--baml-survey-10733710,http://www.channelnewsasia.com/image/10733708/16x9/991/557/d95dcb6cc26305b371bf1f349301e4a5/ym/traders-work-on-the-floor-of-the-nyse-in-new-york-3.jpg
5,-0.99999980000004,0,0.09999999800000005,Reuters,"JP Morgan &amp; Chase Co Chief Executive Jamie Dimon and Ford Motor Co Chairman Bill Ford canceled plans to attend a Saudi investor conference, the companies said on Sunday, the latest such high-profile announcements after the disappearance of Saudi journalis… [+3447 chars]","JP Morgan & Chase Co Chief Executive Jamie Dimon and Ford Motor Co  Chairman Bill Ford canceled plans to attend a Saudi investor conference, the companies said on Sunday, the latest such high-profile announcements after the disappearance of Saudi journalist J…",2018-10-15T10:34:36Z,"{'id': None, 'name': 'Rawstory.com'}",JP Morgan and Ford cancel plans for Saudi investor event,https://www.rawstory.com/2018/10/jp-morgan-ford-cancel-plans-saudi-investor-event/,https://www.rawstory.com/wp-content/uploads/2018/10/Jamie-Dimon-CEO-of-JPMorgan-Chase-800x430.jpg
2,-0.99999950000025,0,0.07407407133058995,Matt Giles,"In the ‘Notes and Sources’ section of Andrew Ross Sorkin’s bestseller, Too Big To Fail, the New York Times financial writer and columnist details the extraordinary access he was given about the events of the Lehman Weekend—that is, the two days in mid-Septemb… [+2077 chars]",Looking back at the weekend that nearly destroyed America's economy.,2018-09-20T12:25:38Z,"{'id': None, 'name': 'Longreads.com'}","Eight Days in September, A Decade Later",https://longreads.com/2018/09/20/eight-days-in-september-a-decade-later/,https://longreadsblog.files.wordpress.com/2018/09/ap_10042001982.jpg?w=1200
0,0.0,0,0.0,Michael Grothaus,Richard Branson has told CNBC that Virgin Galactic will begin making space flights in the next several months. Virgin Galactic is Branson’s commercial spaceflight company that aims to begin taking paying customers to outer space. Branson founded Virgin Galact… [+859 chars],"And a ticket will only cost you $250,000. Richard Branson has told CNBC that Virgin Galactic will begin making space flights in the next several months. Virgin Galactic is Branson’s commercial spaceflight company that aims to begin taking paying customers to …",2018-10-09T06:32:11Z,"{'id': None, 'name': 'Fastcompany.com'}","Virgin Galactic will be in space in “weeks not months,” says Branson",https://www.fastcompany.com/90248524/virgin-galactic-will-be-in-space-in-weeks-not-months-says-branson?partner=feedburner&utm_source=feedburner&utm_medium=feed&utm_campaign=Feed%3A+fastcocreate%2Ffeed+%28Co.Create%29,"https://images.fastcompany.net/image/upload/w_1280,f_auto,q_auto,fl_lossy/v1528728154/fcweb/0d-news-placeholder_oqxvpk.jpg"
6,-0.4999999375000079,2,0.20512819986850772,Ben Dummett,"European deal making failed to maintain this years blistering pace in the latest quarter amid a slowdown in the biggest of deals, but some investment bankers expect plenty of smaller and mid-sized ones to take up the slack for rest of the year and into 2019. … [+3650 chars]","European deal making failed to maintain this year’s blistering pace in the latest quarter amid a slowdown in the biggest of deals, but some investment bankers expect plenty of smaller and mid-sized ones to take up the slack for rest of the year and into 2019.",2018-09-30T17:00:09Z,"{'id': 'the-wall-street-journal', 'name': 'The Wall Street Journal'}",European M&A Loses Pace With Drop in Mega Deals,https://www.wsj.com/articles/european-m-a-loses-pace-with-drop-in-mega-deals-1538326807,https://si.wsj.net/public/resources/images/B3-BX453_eurode_SOC_20180930093323.jpg
3,-0.9999996666667778,0,0.08823529152249143,Kimberly Chin,"Mastercard Inc., MA -0.68% Visa Inc. and other financial institutions have agreed to settle a long-running antitrust lawsuit with merchants over the fees they pay when they accept card payments for a proposed settlement amount of about $6.2 billion. The propo… [+2608 chars]","Mastercard, Visa and other financial institutions have agreed to settle a long-running antitrust lawsuit with merchants over the fees they pay when they accept card payments for a proposed settlement amount of $6.2 billion.",2018-09-18T12:23:40Z,"{'id': 'the-wall-street-journal', 'name': 'The Wall Street Journal'}","Mastercard, Visa Agree to Settle Merchant Antitrust Suit",https://www.wsj.com/articles/mastercard-visa-agree-to-settle-merchant-antitrust-suit-1537273419,https://images.wsj.net/im-26936/social
0,0.0,0,0.0,Chicago Tribune,"Photos from the 2018 Bank of America Chicago Marathon on Sunday, Oct. 7, 2018.","Photos from the 2018 Bank of America Chicago Marathon on Sunday, Oct. 7, 2018.",2018-10-07T13:29:00Z,"{'id': None, 'name': 'Chicagotribune.com'}",2018 Chicago Marathon,http://www.chicagotribune.com/sports/chicagomarathon/ct-2018-chicago-marathon-photos-20181007-photogallery.html,http://www.trbimg.com/img-5bba0a50/turbine/ct-2018-chicago-marathon-photos-20181007
3,0.24999996875000394,5,0.1777777738271606,,"REUTERS: Bank of America Corp's loan growth lagged rivals and fees from advising on deals and underwriting bonds fell in the third quarter, sending its share price almost 3 percent lower, even as profit beat expectations. The No. 2 U.S. bank's profit rose 35 … [+3317 chars]","Bank of America Corp reported a better-than-expected rise in quarterly profit on Monday as the second-largest U.S. lender reined in costs, while higher interest rates and loan growth helped offset lower bond trading revenue.",2018-10-15T16:25:48Z,"{'id': None, 'name': 'Channelnewsasia.com'}",Bank of America's lagging loan growth overshadows profit gains,https://www.channelnewsasia.com/news/business/bank-of-america-s-lagging-loan-growth-overshadows-profit-gains-10830094,http://www.channelnewsasia.com/image/10830092/16x9/991/557/35b6d3b860535adf98c3a8c99eedf022/Ru/a-bank-of-america-merrill-lynch-sign-is-seen-on-a-building-that-houses-its-offices-in-singapore-2.jpg
0,0.0,0,0.0,https://www.facebook.com/bbcnews,"Image copyright Getty Images One of Europe's biggest banks, Banco Santander, has poached the head of investment banking at UBS to be its next chief executive. Andrea Orcell will replace José Antonio Alvarez, who has been at the helm since January 2015. He has… [+810 chars]","One of Europe's biggest banks, Banco Santander, has poached the head of investment banking at UBS to be its next chief executive.",2018-09-25T16:50:59Z,"{'id': 'bbc-news', 'name': 'BBC News'}",Santander appoints new chief executive,https://www.bbc.co.uk/news/business-45643975,https://ichef.bbci.co.uk/news/1024/branded_news/E807/production/_93799395__90792233_gettyimages-103231721.jpg
4,-0.9999997500000625,0,0.0952380929705216,Reuters,"By: Reuters | Beijing | Published: September 18, 2018 1:17:21 pm “The growing trade dispute has hurt trading sentiment. The impact on economic growth is slowly dripping in, which again hurts oil prices,” Wang Xiao, head of crude research at Guotai Junan Futur… [+2608 chars]","Russia, the world's largest oil producer, and other producers in OPEC have kept in place a supply agreement to maintain prices while at the same time providing enough oil to the market.",2018-09-18T07:47:21Z,"{'id': None, 'name': 'Indianexpress.com'}",Oil prices drop globally as escalating US-China trade war clouds demand outlook,https://indianexpress.com/article/business/commodities/oil-prices-drop-globally-as-escalating-us-china-trade-war-clouds-demand-outlook-5361914/,https://images.indianexpress.com/2017/10/crude-oil.jpg?w=759
0,0.0,0,0.0,"Lucas Mearian, Lucas Mearian","Companies such as Amazon, Microsoft and Oracle will reap a financial windfall by offering blockchain as a service (BaaS), a market thats quickly growing as companies look for ways to use the distributed ledger technology without spending a lot of money. If ju… [+9208 chars]","Companies such as Amazon, Microsoft and Oracle will reap a financial windfall by offering blockchain as a service (BaaS), a market that’s quickly growing as companies look for ways to use the distributed ledger technology without spending a lot of money. If j…",2018-10-03T19:35:00Z,"{'id': None, 'name': 'Computerworld.com'}",Blockchain-as-a-service predicted to be $7B market,https://www.computerworld.com/article/3237465/enterprise-applications/blockchain-as-a-service-predicted-to-be-7b-market.html,https://images.techhive.com/images/article/2016/06/blockchain_2-100665006-large.3x2.jpg
0,0.0,0,0.0,Michael Grothaus,Richard Branson has told CNBC that Virgin Galactic will begin making space flights in the next several months. Virgin Galactic is Branson’s commercial spaceflight company that aims to begin taking paying customers to outer space. Branson founded Virgin Galact… [+859 chars],"And a ticket will only cost you $250,000. Richard Branson has told CNBC that Virgin Galactic will begin making space flights in the next several months. Virgin Galactic is Branson’s commercial spaceflight company that aims to begin taking paying customers to …",2018-10-09T06:32:11Z,"{'id': None, 'name': 'Fastcompany.com'}","Virgin Galactic will be in space in “weeks not months,” says Branson",https://www.fastcompany.com/90248524/virgin-galactic-will-be-in-space-in-weeks-not-months-says-branson?partner=feedburner&utm_source=feedburner&utm_medium=feed&utm_campaign=Feed%3A+fastcoexist%2Ffeed+%28Co.Exist%29,"https://images.fastcompany.net/image/upload/w_1280,f_auto,q_auto,fl_lossy/v1528728154/fcweb/0d-news-placeholder_oqxvpk.jpg"
1,-0.9999990000010001,0,0.022222221728395074,William Charles,"We have financial relationships with some of the products and services found on this website, we may be compensated if you choose to utilize any of these links when applying. We will only recommend the products that we believe are the best fit for you, the co… [+126 chars]","The Offer No direct link, offer sent out via e-mail. Subject line is ‘Get a $10 Bonus Offer’ Bank of America is offering some people a $10 bonus when they download the app and deposit a check or pay a bill using the app by December 2nd, 2018 Others have the s…",2018-10-02T22:32:37Z,"{'id': None, 'name': 'Doctorofcredit.com'}",[Targeted] Bank of America: $10 Bonus When You Pay A Bill Or Deposit A Check/Pay Credit Card,https://www.doctorofcredit.com/targeted-bank-of-america-10-bonus-when-you-pay-a-bill-or-deposit-a-check-pay-credit-card/,https://www.doctorofcredit.com/wp-content/uploads/2018/10/BOA-10-bonus-for-using-app.png
0,0.99999950000025,2,0.06249999804687507,,"When 20 of Bank of America s top executives met in the US last month to discuss the companys strategy, the burning issue high on the agenda was how to turn round its stuttering investment banking operation. During a record M&amp;A boom that has lifted most of… [+5096 chars]",Executives at US lender ‘hunker down’ after missing out on booming M&A market,2018-10-14T16:31:06Z,"{'id': 'financial-times', 'name': 'Financial Times'}",BofA’s investment bankers brace for shake-up,https://www.ft.com/content/042b5c3a-cf8f-11e8-a9f2-7574db66bcd5,https://www.ft.com/__origami/service/image/v2/images/raw/http%3A%2F%2Fprod-upp-image-read.ft.com%2Febc42764-c82f-11e8-86e6-19f5b7134d1c?source=next-opengraph&fit=scale-down&width=900
0,0.99999950000025,2,0.04651162682531101,SA Editor Liz Kiesche,Worldpay (NYSE: WP ) jumps 3.0% in premarket trading after Bank of America Merrill Lynch upgrades the stock to buy from neutral on increased confidence in Vantiv synergies. BofAML analyst Jason Kupferberg raises price target to $118 from $106. Source:TheFly. … [+137 chars],Worldpay (NYSE:WP) jumps 3.0%&nbsp;in premarket trading after Bank of America Merrill Lynch&nbsp;upgrades&nbsp;the stock to buy from neutral on increased confidence in Vantiv synergies.BofAML analyst,2018-10-03T13:02:35Z,"{'id': None, 'name': 'Seekingalpha.com'}",Worldpay gains 3% after Bank of America upgrades buy,https://seekingalpha.com/news/3394756-worldpay-gains-3-percent-bank-america-upgrades-buy,https://static3.seekingalpha.com/assets/og_image_192-59bfd51c9fe6af025b2f9f96c807e46f8e2f06c5ae787b15bf1423e6c676d4db.png
2,-0.99999950000025,0,0.04347825992438566,SA Editor Gaurav Batavia,Bank of America (NYSE: BAC ): Q3 GAAP EPS of $0.66 beats by $0.04. Revenue of $22.78B (+4.3% Y/Y) beats by $150M. Shares -0.49% PM. Press Release Click to subscribe to real-time analytics on BAC Now read: Citigroup: Now We're Talking » Subscribe for full text… [+18 chars],Bank of America (NYSE:BAC): Q3 GAAP EPS of $0.66 beats by $0.04.Revenue of $22.78B (+4.3% Y/Y) beats by $150M.Shares -0.49% PM.Press Release,2018-10-15T10:57:20Z,"{'id': None, 'name': 'Seekingalpha.com'}","Bank of America beats by $0.04, beats on revenue",https://seekingalpha.com/news/3397190-bank-america-beats-0_04-beats-revenue,https://static3.seekingalpha.com/assets/og_image_192-59bfd51c9fe6af025b2f9f96c807e46f8e2f06c5ae787b15bf1423e6c676d4db.png
0,0.9999990000010001,1,0.024999999375000016,ET Now,"Jayesh Mehta, MD, Bank of America Merrill Lynch (BofAML), firmly believes that the reduction in second half borrowing definitely is a big positive. Now, RBI 's policy call on October 5 will set the tone, he told ETNow. Edited excerpts: Do you expect to see a … [+2698 chars]","The government has to come to terms with GST coming in below Rs 1 lakh crore, the top BofAML official said.",2018-10-01T05:01:17Z,"{'id': 'the-times-of-india', 'name': 'The Times of India'}",Govt can always move buybacks to next year: Jayesh Mehta,https://economictimes.indiatimes.com/markets/expert-view/govt-can-always-move-buybacks-to-next-year-jayesh-mehta/articleshow/66023511.cms,"https://img.etimg.com/thumb/msid-66023595,width-1070,height-580,imgsize-289279,overlay-etmarkets/photo.jpg"
2,-0.99999950000025,0,0.06249999804687507,Options Markets,"For most of this year, the banking sector has been off of the radar for a large majority of the investment community. This has been understandable, given the fact that the Financial Select Sector SPDR ETF ( XLF ) has traded sideways (or even downward) for mos… [+6708 chars]",The banking sector has been asleep for most of the year (particularly through the summer period). But the Financial Select Sector SPDR Fund is now surging to si,2018-09-24T03:18:48Z,"{'id': None, 'name': 'Seekingalpha.com'}",Breakout Alert: Buy Bank Stocks,https://seekingalpha.com/article/4207792-breakout-alert-buy-bank-stocks,https://static3.seekingalpha.com/images/marketing_images/banks_credit_cards/bank_sign_2.jpeg
0,0.9999990000010001,1,0.023255813412655504,Reuters Editorial,"LONDON (Reuters) - HSBC ( HSBA.L ) has hired seven new bankers to expand its power, infrastructure and real estate businesses as part of a global push to serve clients across these industries, the investment bank said in a release on Thursday. It also reshuff… [+1743 chars]","HSBC has hired seven new bankers to expand its power, infrastructure and real estate businesses as part of a global push to serve clients across these industries, the investment bank said in a release on Thursday.",2018-10-04T13:39:22Z,"{'id': 'reuters', 'name': 'Reuters'}","HSBC bolsters infrastructure, power and real estate teams in expansion drive",https://www.reuters.com/article/us-hsbc-bank-plc-infrastructure-moves/hsbc-bolsters-infrastructure-power-and-real-estate-teams-in-expansion-drive-idUSKCN1ME1RM,https://s4.reutersmedia.net/resources/r/?m=02&d=20181004&t=2&i=1311201813&w=1200&r=LYNXNPEE93168
0,0.9999997500000625,4,0.08695651984877131,Georgi Georgiev,"New estimates from Bank of America indicate that the global blockchain market could eventually hit $7 billion. Even though the analysis didnt provide an actual timestamp, it outlined that marquee companies like Microsoft and Amazon can benefit greatly from th… [+1802 chars]","New estimates from Bank of America indicate that the global blockchain market could eventually hit $7 billion. Even though the analysis didn’t provide an actual timestamp, it outlined that marquee companies like Microsoft and Amazon can benefit greatly from t…",2018-10-03T17:00:03Z,"{'id': None, 'name': 'Bitcoinist.com'}",Bank of America: ‘Blockchain Could be a $7 Billion Market’,https://bitcoinist.com/bank-of-america-blockchain-could-be-a-7-billion-market/,https://bitcoinist.com/wp-content/uploads/2017/08/reut-bofa-cover.jpg
0,0.0,0,0.0,"Adam Sarhan, Contributor, Adam Sarhan, Contributor https://www.forbes.com/sites/adamsarhan/","Share to facebook Share to twitter Share to linkedin New York, September 28, 2016: A Wells Fargo retail location in Manhattan. Wells Fargo &amp;amp; Company is scheduled to release earnings before Friday's&amp;nbsp;open. The stock just hit a record high of&am… [+5225 chars]","Wells Fargo is expected to report $1.17/share on $21.63 billion in revenue. Meanwhile, the so-called Whisper number is $1.20.",2018-10-11T16:15:00Z,"{'id': None, 'name': 'Forbes.com'}",Earnings Preview: What To Expect From Wells Fargo On Friday,https://www.forbes.com/sites/adamsarhan/2018/10/11/earnings-preview-what-to-expect-from-wells-fargo-on-friday-6/,https://thumbor.forbes.com/thumbor/600x315/https%3A%2F%2Fspecials-images.forbesimg.com%2Fdam%2Fimageserve%2F945364356%2F960x0.jpg%3Ffit%3Dscale
1,0.0,1,0.04651162682531101,ESPN,"The knockout rounds of the 2019 CONCACAF Gold Cup will be held in four different cities before the final in Chicago, the organization announced on Tuesday. Reliant Stadium in Houston and Lincoln Financial Field in Philadelphia will host the quarterfinals of t… [+1490 chars]",USMNT's Julian Green looks ahead to Thursday's game against Colombia in his father's hometown of Tampa. Michael Bradley comments on the United States' past year since failing to qualify for the World Cup and how excited he is for what's to come. Dave Sarachan…,2018-10-09T15:36:00Z,"{'id': None, 'name': 'Espnfc.com'}","CONCACAF Gold Cup venues confirmed for 2019, semis in Glendale and Nashville",http://www.espnfc.com/concacaf-gold-cup/story/3665105/concacaf-gold-cup-venues-confirmed-for-2019-with-semis-in-glendale-and-nashville,http://a.espncdn.com/combiner/i/?img=/photo/2017/0131/r176840_1296x729_16-9.jpg&site=espnfc
2,-0.99999950000025,0,0.06249999804687507,newsfeedback@fool.com (Rich Duprey),"Sears Holdings ( NASDAQ:SHLD ) is running out of track. The troubled retailer has been a runaway train of woe for years as customers fled and sales plummeted, but it has managed to avoid running off the rails primarily because chairman and CEO Eddie Lampert h… [+2752 chars]",Bankruptcy looks to be dead ahead for the once-iconic retailer.,2018-10-12T02:11:00Z,"{'id': None, 'name': 'Fool.com'}",Is This the End of Sears Holdings?,https://www.fool.com/investing/2018/10/11/is-this-the-end-of-sears-holdings.aspx,https://g.foolcdn.com/image/?url=https%3A%2F%2Fg.foolcdn.com%2Feditorial%2Fimages%2F496556%2Ftoy-train-derail-getty.jpeg&h=630&w=1200&op=resize
0,0.0,0,0.0,Lisa Lockwood,"Thirty designers have been tasked to transform the look of “The Phantom of the Opera” mask in celebration of Broadway’s longest-running musical. The Council of Fashion Designers of America, Bank of America and “The Phantom of the Opera” have teamed up for the… [+1896 chars]",The project supports Broadway Cares/Equity Fights AIDS.,2018-10-15T17:16:59Z,"{'id': None, 'name': 'Wwd.com'}",Designers Create Masks Celebrating 30th Anniversary of “The Phantom of the Opera”,https://wwd.com/fashion-news/fashion-scoops/designers-create-masks-celebrating-30th-anniversary-of-the-phantom-of-the-opera-1202879351/,https://pmcwwd.files.wordpress.com/2018/10/chloe-gosselin.jpg?w=640&h=415&crop=1
4,-0.9999997500000625,0,0.07999999840000004,Ken Martin,Strategic Resource Group Managing Director Burt Flickinger and Hartland &amp; Co. LLC Managing Director Jim Awad on the demise of Sears. Sears Holdings Corp CEO Eddie Lampert has reportedly stepped in to contribute towards a the funding of bankruptcy proceedi… [+1588 chars],"Fox Business Sears CEO steps in for bankruptcy financing: report Fox Business Sears, once the largest retailer in the United States, hopes to sell stores and other assets, including its Kenmore appliances brand and home services business, in court-supervised …",2018-10-15T03:04:16Z,"{'id': None, 'name': 'Foxbusiness.com'}",Sears CEO steps in for bankruptcy financing: report - Fox Business,https://www.foxbusiness.com/markets/sears-ceo-steps-in-for-bankruptcy-financing-report,https://a57.foxnews.com/static.foxbusiness.com/foxbusiness.com/content/uploads/2018/06/0/0/sears_store.jpg?ve=1&tl=1
2,-0.99999950000025,0,0.0476190464852608,Henning Gloystein,"SINGAPORE (Reuters) - Oil markets opened strongly on Tuesday, with Brent crude remaining near a four-year reached the previous session. Oil markets have been driven up by looming U.S. sanctions against Iran and an unwillingness or inability by Middle East dom… [+2291 chars]","Oil markets opened strongly on Tuesday, with Brent crude remaining near a four-year reached the previous session.",2018-09-25T00:57:38Z,"{'id': 'reuters', 'name': 'Reuters'}","Oil firm as OPEC, Russia resist calls to raise output as Iran sanctions loom",https://www.reuters.com/article/us-global-oil/oil-firm-as-opec-russia-resist-calls-to-raise-output-as-iran-sanctions-loom-idUSKCN1M501Z,https://s3.reutersmedia.net/resources/r/?m=02&d=20180925&t=2&i=1307855264&w=1200&r=LYNXNPEE8O016
2,0.0,2,0.10526315512465383,Noel Randewich,SAN FRANCISCO (Reuters) - The technology sector appears to be doing just fine on Wall Street a week after it lost two of its highest-profile components to a newly christened communication services group. The S&amp;P 500 technology index.SPLRCT has gained 1.3 … [+2557 chars],The technology sector appears to be doing just fine on Wall Street a week after it lost two of its highest-profile components to a newly christened communication services group.,2018-10-02T11:14:15Z,"{'id': 'reuters', 'name': 'Reuters'}",U.S. tech sector getting by without Facebook and Alphabet,https://www.reuters.com/article/us-usa-stocks-tech/u-s-tech-sector-getting-by-without-facebook-and-alphabet-idUSKCN1MC1CK,https://s2.reutersmedia.net/resources/r/?m=02&d=20181002&t=2&i=1310430898&w=1200&r=LYNXNPEE910W3
3,-0.49999987500003124,1,0.11111110802469146,Medha Singh,"(Reuters) - U.S. stocks treaded water on Tuesday, pressured by worries of a euro zone breakup after anti-euro comments from an Italian lawmaker. Italy would enjoy more favorable economic conditions outside of the euro zone, said Claudio Borghi, a euroskeptic … [+2158 chars]","U.S. stocks treaded water on Tuesday, pressured by worries of a euro zone breakup after anti-euro comments from an Italian lawmaker.",2018-10-02T15:03:20Z,"{'id': 'reuters', 'name': 'Reuters'}",U.S. stocks flat as Italy worries weigh,https://www.reuters.com/article/us-usa-stocks/u-s-stocks-flat-as-italy-worries-weigh-idUSKCN1MC1FG,https://s3.reutersmedia.net/resources/r/?m=02&d=20181002&t=2&i=1310473738&w=1200&r=LYNXNPEE910XO
0,0.9999997500000625,4,0.0784313710111496,Christopher Johnson,"LONDON (Reuters) - Oil prices rose on Monday as investors focused on the impact of U.S. sanctions on Iran despite assurances by Washington that Saudi Arabia, Russia and the United States could together raise output fast enough to offset falling supplies. U.S.… [+1979 chars]","Oil prices rose on Monday as investors focused on the impact of U.S. sanctions on Iran despite assurances by Washington that Saudi Arabia, Russia and the United States could together raise output fast enough to offset falling supplies.",2018-09-17T13:55:20Z,"{'id': 'reuters', 'name': 'Reuters'}",Oil higher as U.S. sanctions on Iran raise supply concerns,https://www.reuters.com/article/us-global-oil/oil-higher-as-u-s-sanctions-on-iran-raise-supply-concerns-idUSKCN1LX01V,https://s2.reutersmedia.net/resources/r/?m=02&d=20180917&t=2&i=1305096619&w=1200&r=LYNXNPEE8G01E
